{
  "$schema": "../../../../schemas/accession-media-presentation-v2.schema.json",
  "record_control": {
    "revision": 1,
    "record_status": "reviewed",
    "constructor": {
      "actor_id": "codex-task:vera-molnar-accession-2026-08-23",
      "role": "constructor",
      "constructed_at": "2026-08-23T10:15:00Z"
    },
    "review": {
      "actor_id": "claude-reviewer:museum-governance-2026-10-18-independent",
      "role": "reviewer",
      "reviewed_at": "2026-10-18T09:39:49Z",
      "reviewed_commit": "9dd1c3e9ae7c0d8c77071b0b109a2cdc9bb7095f",
      "outcome": "approved",
      "payload_sha256": "sha256:eadc36341a359520b092fa318cf38167fc963fa55562d6e10e2e34639f066799"
    }
  },
  "record_type": "ACCESSION_MEDIA_PRESENTATION",
  "schema_profile": "6529NM_ACCESSION_MEDIA_PRESENTATION_V2",
  "accession_lot_id": "6529NM.2026.003",
  "generated_at": "2026-08-23T10:15:00Z",
  "transform": {
    "profile": "6529NM_WEB_PRESENTATION_WEBP_V2_Q82_M6_FIXED_ICC",
    "implementation": "Pillow 12.3.0",
    "format": "image/webp",
    "quality": 82,
    "method": 6,
    "widths": [
      640,
      1280,
      2400
    ],
    "resize_filter": "Lanczos",
    "upscale": false,
    "orientation": "EXIF transpose before resize",
    "colour_management": "embedded profiles converted to sRGB; untagged sources treated as sRGB; alpha retained",
    "icc_profile_sha256": "sha256:4ed6f6f05df0d17516662c5fe06ac90e14e0c1936abd15a491b57998c56aef86",
    "metadata": "source metadata stripped; output sRGB ICC profile retained"
  },
  "delivery": {
    "status": "approved_for_contextual_museum_display",
    "authority_record_id": "6529NM.2026.003.DISPLAY-01",
    "authority_path": "records/accessions/6529NM.2026.003/public/web-presentation-authority.md",
    "cdn_base_url": "https://d3lqz0a4bldqgf.cloudfront.net",
    "cache_control": "public, max-age=31536000, immutable",
    "key_profile": "museum/accessions/{accession_lot_id}/{work_entity_id}/{source_sha256}/{transform_profile}/{width}.webp",
    "overwrite_policy": "fail if an existing key does not contain the declared bytes"
  },
  "rights_boundary": {
    "status": "CC BY-NC 4.0; Museum display and noncommercial reuse subject to attribution and the license",
    "source_originals": "The exact Art Blocks preview remains the recorded source object and is not replaced by these delivery surrogates.",
    "technical_transformation": "Proportion-preserving resize, sRGB normalization and WebP compression for browser delivery; no crop, watermark, retouching or content alteration.",
    "no_general_reuse": "No permission is asserted beyond CC BY-NC 4.0; reuse must preserve attribution, remain noncommercial and comply with the license."
  },
  "items": [
    {
      "work_entity_id": "6529NM-W-0029",
      "media_reference_entity_id": "6529NM-MED-0052",
      "source": {
        "role": "fixity_verified_token_source",
        "url": "https://media-proxy.artblocks.io/1/0xe034bb2b1b9471e11cf1a0a9199a156fb227aa5d/210.png",
        "mime_type": "image/png",
        "sha256": "sha256:c1b6541832f2a237555adffae2f4870143a976549e591e2dbaa4d3d87f75d166",
        "byte_size": 330363,
        "pixel_width": 2400,
        "pixel_height": 2400,
        "exif_orientation_applied": false,
        "colour_profile_status": "untagged_assumed_srgb"
      },
      "presentation": {
        "role": "web_presentation_surrogate",
        "alt_text": "A square generative composition in dark cobalt blue and warm white. Large blue fields occupy the upper right and lower left. White T forms descend through the lower-left field, with a small white F at the left edge. The lower-right area combines a thin horizontal rule, vertical lines, an offset blue block, and a dense rectangular pattern.",
        "alt_text_status": "reviewed_accessibility_description",
        "public_widths": [
          640,
          1280,
          2400
        ],
        "derivatives": [
          {
            "width": 640,
            "height": 640,
            "mime_type": "image/webp",
            "sha256": "sha256:a53b0dbde5a8a43c8e25b541311f38998a106683901dab95490c1d02083bcbc1",
            "byte_size": 11320,
            "repository_path": "media/accessions/6529NM.2026.003/6529NM-W-0029/c1b6541832f2a237555adffae2f4870143a976549e591e2dbaa4d3d87f75d166/webp-v2-q82-m6-fixed-icc/640.webp",
            "url": "https://d3lqz0a4bldqgf.cloudfront.net/museum/accessions/6529NM.2026.003/6529NM-W-0029/c1b6541832f2a237555adffae2f4870143a976549e591e2dbaa4d3d87f75d166/webp-v2-q82-m6-fixed-icc/640.webp",
            "cache_control": "public, max-age=31536000, immutable"
          },
          {
            "width": 1280,
            "height": 1280,
            "mime_type": "image/webp",
            "sha256": "sha256:3e9a68c8d1488592826567430906e5c37b5b304efff556dc8c3c422a04c42555",
            "byte_size": 24158,
            "repository_path": "media/accessions/6529NM.2026.003/6529NM-W-0029/c1b6541832f2a237555adffae2f4870143a976549e591e2dbaa4d3d87f75d166/webp-v2-q82-m6-fixed-icc/1280.webp",
            "url": "https://d3lqz0a4bldqgf.cloudfront.net/museum/accessions/6529NM.2026.003/6529NM-W-0029/c1b6541832f2a237555adffae2f4870143a976549e591e2dbaa4d3d87f75d166/webp-v2-q82-m6-fixed-icc/1280.webp",
            "cache_control": "public, max-age=31536000, immutable"
          },
          {
            "width": 2400,
            "height": 2400,
            "mime_type": "image/webp",
            "sha256": "sha256:0ec810b0e62cdc9c4cfaf2a24553b4feaf57e49a877d519f7dda5300c78dc436",
            "byte_size": 48920,
            "repository_path": "media/accessions/6529NM.2026.003/6529NM-W-0029/c1b6541832f2a237555adffae2f4870143a976549e591e2dbaa4d3d87f75d166/webp-v2-q82-m6-fixed-icc/2400.webp",
            "url": "https://d3lqz0a4bldqgf.cloudfront.net/museum/accessions/6529NM.2026.003/6529NM-W-0029/c1b6541832f2a237555adffae2f4870143a976549e591e2dbaa4d3d87f75d166/webp-v2-q82-m6-fixed-icc/2400.webp",
            "cache_control": "public, max-age=31536000, immutable"
          }
        ]
      }
    }
  ]
}
